{
  "schema_version": "agentcafe.config_diff.v1",
  "trace_id": "trace-mvp2-diff-secret-redaction",
  "diff_id": "diff-20260628-0003",
  "generated_at": "2026-06-28T08:00:00Z",
  "expires_at": "2026-06-28T08:10:00Z",
  "target": {
    "runtime": "claude",
    "source_id": "claude-user-settings",
    "path": "~/redacted/.claude/settings.json",
    "format": "json"
  },
  "changes": [
    {
      "op": "set",
      "field": "mcpServers.internal.headers.Authorization",
      "before": {
        "kind": "missing"
      },
      "after": {
        "kind": "field_presence",
        "field": "Authorization",
        "sha256_12": "60f8d7ab12e9"
      },
      "risk_codes": ["authorization_header_present"]
    }
  ],
  "requires_snapshot": true,
  "requires_confirmation": true,
  "confirmation_token_hint": "Confirm from this exact diff before apply; token expires with expires_at.",
  "expected_source_hash_12": "6a1d02cc2b49",
  "would_execute_commands": false,
  "risk_findings": [
    {
      "code": "authorization_header_present",
      "severity": "high",
      "message": "An authorization header would be configured and is represented only as presence plus hash.",
      "recommended_action": "Keep authorization headers in a local secret store or runtime-supported environment mechanism."
    }
  ],
  "status": "ready_for_confirmation",
  "error": null,
  "redaction_notice": "Diff values are summarized; secrets, prompts, transcripts, tool payloads, shell output, nonce plaintext, and snapshot payloads are omitted."
}
